<?xml version="1.0" standalone="no"?>
<!DOCTYPE TheBench SYSTEM "The-Bench.dtd">
<TheBench>
<Artist>
  <name>
    inser a person's name here
    </name>
  <bio>
    insert data here
    </bio>
  <medium>
    and here
    </medium>
  <showcase>
    </showcase>
  <contact>
    <email>
      </email>
    <phone>
      </phone>
  </contact>
</Artist>

<Art>
  <artist>
    </artist>
  <title>
    </title>
  <subject> <!-- (Who or What is Represented?) -->
    </subject>
  <date> <!-- (When was it made? Is it a copy of something older? Was it made before or after other similar works?) -->
    </date>
  <provenance> <!-- (Where was it made? For whom? Is it typical of the art of a geographical area?) -->
    </provenance>
  <location> <!-- (Where is the work of art now? Where was it originally located?) -->
    </location>
  <technique> <!-- How was the work created? -->
    </technique>
  <medium> <!-- What materials is the art made of? -->
    </medium>
</Art>

<Event>
  <location> </location>
  <date>  </date> <!-- and close all the rest of tags -->
  <time>
  <artists>
  <misc>
</Event>

<Apply>
  <name>
  <contact>
    <email>
    <phone>
  <medium>
</Apply>
</TheBench>
